<?xml version="1.0"?>
<xs:schema xmlns:xs="http://www.w3.org/2001/XMLSchema" attributeFormDefault="unqualified" elementFormDefault="qualified">

<xs:element name="content">
    <xs:complexType >
			<xs:sequence>
                <xs:element name="informacje" type="informacjeType"/>
                <xs:element name="links" type="linksType"/>
            </xs:sequence>
    </xs:complexType >
</xs:element>

<xs:complexType name="informacjeType">
	<xs:sequence>
        <xs:element name="temat" type="xs:string" minOccurs="0" maxOccurs="unbounded"/>
    </xs:sequence>
</xs:complexType>

<xs:complexType name="linksType">
		<xs:sequence>
			<xs:element name="link" type="linkType" minOccurs="0" maxOccurs="unbounded"/>
		</xs:sequence>
	</xs:complexType>

    <xs:complexType name="linkType">
		<xs:simpleContent>
			<xs:extension base="xs:string">
			 <xs:attribute name="source" type="xs:anyURI"/>
			</xs:extension>
		</xs:simpleContent>
	</xs:complexType>

</xs:schema>